user_id,tweet_date,user,tweet_text,tidy_tweet
1228066492236914705,2020-07-18 00:25:21,Beekoda,"@TwoToOblivion @SlingShot206 Frame data, damage output, knockback, etc",Frame data damage output knockback etc
234527036,2020-07-18 00:25:20,empp126,"@seawiz2 I do too. I seem to be having a rather passionate reaction to much today. Along with everything else, what… https://t.co/w6RfxDKs22",too seem having rather passionate reaction much today Along with everything else what
818500734283120640,2020-07-18 00:25:20,realin31,"RT @ProjectLincoln: Unidentified military are kidnapping protestors in Portland.

Schools are being forced to reopen despite 11 days of rec…",Unidentified military are kidnapping protestors Portland Schools are being forced reopen despite days rec
1244270209554354182,2020-07-18 00:25:20,Kittenmoonbean,RT @ewarren: I’ve said it before and I’ll say it again: Allowing the Trump administration to have control of such critical data is potentia…,said before and say again Allowing the Trump administration have control such critical data potentia
